,author,cook_time_minutes,description,error,footnotes,ingredients,instructions,photo_url,prep_time_minutes,rating_stars,review_count,time_scraped,title,total_time_minutes,url,Paella type
15,Pam Anderson,15,"An easy no-fuss paella dish, packed with chicken, spicy chorizo sausage, shrimp and saffron-infused rice.",False,['This recipe is based on Easy Paella submitted by CONNORIAN.'],"['2 pounds boneless, skinless chicken thighs, cut into 2 inch pieces', '4 tablespoons olive oil, divided', '1 tablespoon paprika', '2 teaspoons dried oregano', 'salt', 'freshly ground black pepper', '12 ounces chorizo sausage, cut into 1/2 inch thick pieces', '1 large onion, diced', '1 red bell pepper, seeded and diced', '4 cloves garlic, minced', '2 bay leaves', '1/8 teaspoon red pepper flakes', '1 pinch saffron threads', '2 cups short grain rice', '1 quart chicken broth', '1 pound shrimp, peeled and deveined', '2 lemons, zested', '1/2 cup chopped fresh parsley leaves']","['In a medium bowl, mix together chicken pieces, 2 tablespoons oil, paprika, oregano, salt and pepper; set aside.', 'Heat a large, deep pan over medium-high heat. Add chicken to hot skillet and cook until well browned and cooked through, about 6 to 8 minutes. Remove from pan and set aside.', 'Heat remaining 2 tablespoons oil in the pan over medium-high heat. Stir in sausage, onion and bell pepper; cook until tender, about 5 to 7 minutes. Add garlic, bay leaves, pepper flakes, saffron and rice; cook until well coated with the oil. Add chicken broth; cover and bring to a boil. Reduce heat to low and simmer until almost all of the liquid is absorbed, about 15 to 20 minutes. Stir in cooked chicken, shrimp, lemon zest, and parsley; cover and continue to cook until shrimp are pink, about 5 to 7 minutes longer. Stir well and serve.']",http://images.media-allrecipes.com/userphotos/250x250/989747.jpg,50,0.0,0,1498102995,Classic Paella,65,http://allrecipes.com/Recipe/109183/,Mixed
16,Food & Wine,0,"We've based this salad very loosely on paella, the Spanish rice dish - and you can actually make it with rice if you like. Our choice, though, is orzo, the tiny rice-shaped pasta. The cooking instructions are the same whichever you choose.",False,[],"['3 1/2 tablespoons olive oil', '1 onion, chopped', '1 green bell pepper, chopped', '1 1/4 teaspoons salt', '6 ounces dried chorizo or other firm spicy sausage such as pepperoni, quartered lengthwise and sliced thin crosswise', '1/4 teaspoon dried red pepper flakes', '1 teaspoon paprika', '1 pound boneless, skinless chicken breasts (about 3) cut into 1/2-inch cubes', '1/4 teaspoon fresh-ground black pepper', '1/2 pound orzo', '2 tablespoons lemon juice', '1 tomato, diced', '1/2 cup chopped fresh parsley']","['In a large frying pan, heat 1 1/2 tablespoons of the oil over moderately low heat. Add the onion, bell pepper, and 1/4 teaspoon of the salt. Cook, stirring occasionally, until the vegetables start to soften, about 10 minutes.', 'Increase the heat to moderately high. Add the chorizo and cook, stirring occasionally, for 2 minutes. Stir in the red-pepper flakes, paprika, chicken, 1/2 teaspoon of the salt, and the black pepper and cook, stirring frequently, until the chicken is almost done, about 3 minutes. Cover the pan and remove from the heat. Steam the chicken for 2 minutes. Transfer the mixture to a large glass or stainless-steel bowl to cool.', 'Meanwhile, in a large pot of boiling, salted water, cook the orzo until done, about 12 minutes. Drain. Rinse with cold water and drain thoroughly.', 'Add the drained orzo to the chicken mixture. Toss with the lemon juice, the remaining 2 tablespoons oil and 1/2 teaspoon salt, the tomato, and the parsley.']",http://images.media-allrecipes.com/global/recipes/nophoto/nopicture-910x511.png,0,0.0,0,1498105082,Paella Salad,0,http://allrecipes.com/Recipe/113672/,Traditional
17,Food & Wine,0,"You don't need a paella pan to make paella; any large frying pan will do. Serve this paella hot or at room temperature (as it is often eaten in Spain), as is or topped with toasted sliced almonds.",False,[],"['2 tablespoons olive oil', '1 onion, chopped', '1/4 cup drained sliced jarred pimientos, chopped', '1 tomato, peeled and chopped', '1 clove garlic, minced', '1 1/4 teaspoons salt', '1/4 teaspoon turmeric', '2 cups rice, preferably medium-grain such as arborio', '3 cups canned low-sodium chicken broth or homemade stock', '1 cup water', '1/2 cup chopped flat-leaf parsley', '1/2 pound asparagus, tough ends snapped off and discarded, spears cut into 2-inch pieces', '1 cup frozen peas', '1 (6.5 ounce) jar marinated artichoke hearts, drained and sliced', '2 cups drained and rinsed canned cannellini beans']","['In a large frying pan, heat the oil over moderately low heat. Add the onion and cook, stirring occasionally, until translucent, about 5 minutes. Add the pimientos, tomato, and garlic and cook, stirring occasionally, for 2 minutes.', 'Stir in the salt, turmeric, and rice. Add the chicken broth, water, and parsley and bring to a boil. Continue cooking over moderate heat, stirring frequently, until most of the liquid has been absorbed by the rice, about 7 minutes.', 'Stir in the asparagus, peas, artichokes, and beans. Reduce the heat and simmer, covered, for 15 minutes. Remove from the heat and let stand, covered, for 10 minutes before serving.']",http://images.media-allrecipes.com/global/recipes/nophoto/nopicture-910x511.png,0,0.0,0,1498105659,Spring-Vegetable Paella,0,http://allrecipes.com/Recipe/113808/,Traditional
18,Martha Stewart,0,Different brands of clam juice vary in sodium content; choose one that contains sixty milligrams per ounce or less.,False,[],"['3 cups homemade chicken stock, or canned low-sodium chicken broth, skimmed of fat', '2 cups low-sodium clam juice', '1 pinch saffron', '1 cup sugar-snap peas, tough strings removed, cut in half on the bias', '2 links chicken sausage, cut into 1/2-inch rounds', '12 medium shrimp, peeled and deveined', '12 squid, cleaned and cut into 1-inch rings', '1 medium onion, peeled and finely diced', '2 tablespoons minced garlic', '1 red bell pepper, seeded and cut into 1-inch-long matchsticks', '1 yellow bell pepper, seeded and cut into 1-inch-long matchsticks', '1 pound uncooked paella rice', '1 pound cockles and mussels', '1/4 teaspoon paprika', '1/4 teaspoon freshly ground black pepper', '6 plum tomatoes, seeded and cut into 1/4-inch dice', '1/4 cup coarsely chopped fresh flat-leaf parsley', 'Olive oil cooking spray']","['Place stock, clam juice, and saffron in a medium saucepan over medium-high heat. Bring to a boil, cover, and reduce heat; simmer 15 minutes. Remove from heat; set aside.', 'Prepare an ice bath. Bring a medium saucepan of water to a boil, and blanch sugar snap peas until bright green and just tender, about 1 minute. Using a slotted spoon, transfer peas to ice bath; let cool. Drain, and set aside.', 'Coat a paella pan (or a 6-quart Dutch oven that measures 11 inches in diameter and 5 inches in height) with cooking spray; set over medium-high heat. Add sausage, and cook until well browned, turning, about 5 minutes.', 'Add shrimp, and cook 1 1/2 minutes. Add squid, and cook until opaque, about 1 1/2 minutes more. Transfer seafood and sausage to a plate, and set aside.', 'Add onion, garlic, and bell peppers to paella pan; saute until onions are translucent, about 3 minutes. Add uncooked rice; saute until translucent, 1 to 2 minutes more. Add 4 cups reserved stock mixture; bring to a boil. Reduce heat to medium low, and cover. Cook until most liquid has been absorbed and the rice is just tender, about 10 minutes.', 'Meanwhile, place remaining cup of stock mixture, cockles, and mussels in a saute pan over medium-high heat. Cover, and bring to boil. Cook until all shells have opened, 2 to 3 minutes; discard any that remain closed.', 'Add paprika, black pepper, tomatoes, shrimp, squid, and sausage to rice mixture; combine. Add cockles, mussels, and cooking liquid to mixture, being careful to leave behind any residue in saute pan. Stir in parsley; garnish with peas. Serve immediately.']",http://images.media-allrecipes.com/global/recipes/nophoto/nopicture-910x511.png,0,0.0,0,1498105953,Seafood Paella,0,http://allrecipes.com/Recipe/115831/,Mixed
19,Taste of Home Test Kitchen,10,"One bite of the delicious rice recipe our Test Kitchen concocted and you're bound to have a passion for paella. Colorful and filling, it makes a good hearty side dish or meatless entree. Paella is ideal potluck and party food, too.",False,"['Nutritional Analysis: One serving (1-2/3 cups) equals 359 calories, 6 g fat (1 g saturated fat), 0 cholesterol, 1,254 mg sodium, 68 g carbohydrate, 8 g fiber, 11 g protein. Diabetic Exchanges: 3 starch, 3 vegetable, 1 fat.']","['1 large onion, chopped', '2 tablespoons olive or canola oil', '1 1/2 cups uncooked long grain rice', '3 garlic cloves, minced', '2 1/2 cups vegetable broth', '1 1/2 cups sliced carrots', '1 1/2 cups frozen cut green beans, thawed', '1 medium sweet red pepper, julienned', '1 medium zucchini, quartered lengthwise and cut into 1/2 inch slices', '1 teaspoon salt', '1/2 teaspoon dried thyme', '1/4 teaspoon ground turmeric', '1/8 teaspoon paprika', '1 (14 ounce) can water-packed artichoke hearts, drained and quartered', '2 plum tomatoes, seeded and chopped', '1 cup frozen peas, thawed', '1 cup frozen corn, thawed']","['In a large nonstick skillet, saute onion in oil for 2 minutes. Add rice and garlic; saute 1 minute longer. Add the next nine ingredients; mix well. Bring to a boil. Reduce heat; cover and simmer for 25-30 minutes or until liquid is absorbed and rice is tender. Stir in the artichoke hearts, tomatoes, peas and corn; heat through.']",http://images.media-allrecipes.com/userphotos/560x315/38035.jpg,35,4.38,22,1498107943,Garden Paella,45,http://allrecipes.com/Recipe/119704/,Other
20,Epicurious.com,0,"A fabulous all-in-one dish, similar to paella, from Lucques in Los Angeles.",False,[],"['2 cups chicken stock or canned low-sodium chicken broth', '1/4 teaspoon saffron strands', '2 tablespoons extra-virgin olive oil', '1/4 cup chopped shallots', '1 cup arborio rice or medium-grain white rice', '4 garlic cloves, minced', '1/2 cup dry white wine', '1 cup bottled clam juice', '20 mussels, scrubbed and debearded', '12 littleneck clams, scrubbed', '12 uncooked large shrimp, peeled, deveined, tails left intact', '3/4 cup chopped tomatoes', '1/4 cup sliced green onions', 'Lemon wedges', 'Green Olive Relish']","['Bring stock and saffron to simmer in medium saucepan. Remove from heat; cover to keep warm.', 'Heat olive oil in heavy large pot over medium heat. Add shallots; saute until tender, about 2 minutes. Add rice and garlic; stir 1 minute. Add white wine and stir until absorbed, about 2 minutes. Add 1/2 cup saffron stock and simmer until absorbed, stirring frequently. Add remaining stock 1/2 cup at a time, allowing stock to be absorbed before adding more and stirring frequently until rice is cooked halfway, about 10 minutes. Add clam juice, mussels, littleneck clams, shrimp and chopped tomatoes. Cover and simmer until rice is tender, mussels and clams open, shrimp are cooked through and liquid is absorbed, about 10 minutes (discard any mussels and clams that do not open). Divide seafood and saffron risotto equally among 4 bowls. Sprinkle with sliced green onions. Garnish with lemon wedges. Serve, passing Green Olive Relish separately.']",http://images.media-allrecipes.com/global/recipes/nophoto/nopicture-910x511.png,0,0.0,0,1498112199,"Mussels, Clams and Shrimp with Saffron Risotto and Green Olive Relish",0,http://allrecipes.com/Recipe/127056/,Mixed
21,Susie Quick,15,"This is a simple, speedy version of paella, which usually requires cooking in the oven as well as on the stove. Paella gets its distinctive taste from the rich, smoky flavor of Spanish paprika. If you can't find it, mix equal parts sweet Hungarian paprika with chipotle powder. To save even more time, buy shrimp already peeled and deveined.",False,[],"['1 (8 ounce) package yellow-rice mix', '1 cup frozen petite peas', '4 teaspoons olive oil', '3 ounces smoked chorizo sausage links, sliced', '1 extra large onion, chopped', '1 red bell pepper, chopped', '2 cloves garlic, chopped', '1 1/2 teaspoons Spanish paprika (preferably sweet)', '1 pint cherry tomatoes', '14 medium shrimp', 'Kosher salt and freshly ground pepper', '2 tablespoons chopped flat leaf parsley']","['Prepare yellow rice according to package directions, but omit butter and oil; use only 1/4 cups water (the rice should be slightly al dente when cooked). Remove pan from heat and stir in the frozen peas; cover and set aside.', 'Meanwhile, heat 2 teaspoons oil in a wok (or 12-inch nonstick skillet) over medium-high heat. Stir-fry sausage until browned. Transfer to a plate. Add onion, bell pepper, garlic, and remaining oil to wok; stir-fry until onions are soft, about 3 minutes. Add paprika and stir-fry 1 minute.', 'Return sausage to skillet along with tomatoes and shrimp. Stir-fry until shrimp are just cooked through and pink, about 2 minutes. Add rice and peas to wok and cook, stirring, until ingredients are combined. Season to taste with salt and pepper. Top with parsley and serve.']",http://images.media-allrecipes.com/global/recipes/nophoto/nopicture-910x511.png,0,0.0,0,1498112112,Paella Stir-Fry,15,http://allrecipes.com/Recipe/127968/,Seafood
22,Anne Egan,15,.,False,[],"['1 tablespoon olive oil', '1 onion, chopped', '3 cloves garlic, chopped', '1 cup basmati or long-grain white rice', '1 yellow squash, cut into 1/2-inch cubes', '1 red bell pepper, cut into 1/2-inch pieces', '1 (15 ounce) can diced tomatoes', '1 (14.5 ounce) can reduced-sodium vegetable broth', '1 cup water', '1 bay leaf', '1/4 teaspoon salt', '1 (15 ounce) can cannellini or great Northern beans, rinsed and drained', '1 cup frozen peas, thawed']","['Warm the oil in a Dutch oven over medium heat. Add the onion and garlic. Cook, stirring, for 3 minutes, or until lightly browned. Add the rice, squash, and bell pepper. Cook for 5 minutes, stirring occasionally, or until the pepper starts to soften. Add the tomatoes (with juice), broth, water, bay leaf, and salt. Reduce the heat to medium-low.', 'Cover and simmer for 20 minutes, or until the rice is tender. Add the beans and peas. Cook, stirring gently, for 3 to 5 minutes, or until heated through. Remove and discard the bay leaf.']",http://images.media-allrecipes.com/global/recipes/nophoto/nopicture-910x511.png,35,0.0,0,1498111961,Vegetable Paella,50,http://allrecipes.com/Recipe/128383/,Other
23,Readers Digest,25,"This is a traditional recipe from the coastal regions in southeastern Spain. Paella lends itself to an endless array of variations, so if you don't like snails or eel, substitute other meat or seafood that you do like. ",False,[],"['1/4 cup extra-virgin olive oil', '3 cloves garlic, peeled and lightly crushed', '1 roasting chicken (or rabbit), boned and cut into small chunks', '3 cups short-grain rice', '1 1/2 quarts boiling water', '2 pounds snails, clams, or shrimp, cleaned', '2 artichoke hearts, cleaned and chopped', '8 ounces green beans, cut into short lengths', '1 3/4 cups peas', '1 pound mussels, in shell', '1 pound eel or tuna, cleaned and chopped', 'Salt and freshly ground black pepper', '1 bay leaf', '8 saffron threads, crumbled']","['Preheat the oven to 400 degrees F. Heat the oil in a paella pan or large frying pan about 18 inches in diameter over medium heat. Saute the garlic for 2 to 3 minutes. Discard the garlic.', 'Brown the chicken in the same pan for 5 minutes. Add the rice and stir until well coated with oil. Pour in the water and bring to a boil. Add the snails, artichokes, green beans, peas, mussels, and eel. Season with salt and pepper. Add the bay leaf and saffron. Continue cooking over medium-high heat until the liquid has almost all been absorbed.', 'Discard any clams or mussels that do not open. The rice grains should still be slightly crunchy and there should still be some liquid in the pan. Bake in the oven, uncovered, for 10 minutes. Cover the pan with foil or parchment paper and let stand for 10 minutes. Remove the bay leaf before serving.']",http://images.media-allrecipes.com/global/recipes/nophoto/nopicture-910x511.png,30,0.0,0,1498113321,"Paella, Valencia-Style",65,http://allrecipes.com/Recipe/129360/,Mixed
24,Sarah Breckenridge,0,.,False,[],"['4 teaspoons olive oil', '8 ounces chicken breast, cubed', '8 ounces large shrimp', '4 scallions, white bulbs and green tops chopped and reserved separately', '2 cloves garlic, minced', '1/4 teaspoon saffron threads, crumbled', '1/2 teaspoon paprika', '1/4 teaspoon turmeric (for color)', '2 cups orzo', '2 (14.5 ounce) cans chicken broth', '1 (14.5 ounce) can diced tomatoes, drained']","['In a skillet, heat 1 teaspoon oil over medium-high heat. Add chicken and saute until golden brown on all sides, about 4 minutes. Remove to a plate. Add 1 teaspoon oil to skillet and saute shrimp, turning once, until opaque, about 2 minutes. Remove to plate.', 'Add remaining oil to skillet and saute scallion whites and garlic until soft. Add saffron, paprika, turmeric, and orzo. Toast until orzo is golden, about 2 to 3 minutes. Add broth and bring to a boil. Reduce heat; simmer, partially covered, until orzo is al dente, about 8 minutes.', 'Return chicken and shrimp to skillet, add tomatoes, and cook until liquid is absorbed and chicken is cooked through, about 2 minutes. Top with scallions and serve.']",http://images.media-allrecipes.com/global/recipes/nophoto/nopicture-910x511.png,0,0.0,0,1498112713,Orzo 'Paella',0,http://allrecipes.com/Recipe/131316/,Mixed
25,Every Day with Rachael Ray,15,This rice dish is bursting with ingredients and flavor. It's a great dinner-party dish.,False,[],"['2 (14 ounce) cans chicken broth', '2 pinches saffron', '3 tablespoons extra-virgin olive oil', '1 small onion, chopped', '1 red bell pepper, cut into 1/4-inch-wide strips', 'Salt and freshly ground pepper', '1 tomato, seeded and diced', '1 garlic clove, finely chopped', '2 cups Valencia rice, such as Goya brand', '12 ounces chorizo, cut diagonally into 1/2-inch-thick slices', '8 large shrimp, peeled and deveined, tails left intact', '12 mussels, scrubbed and debearded', '1/2 pound squid, cut into 1/4-inch rings', '1/4 cup frozen peas', '1 lemon cut into wedges', '2 tablespoons chopped parsley']","['In a small saucepan, bring the broth to a boil and stir in the saffron. Reduce the heat to low and simmer.', 'Meanwhile, heat the olive oil in a large skillet over medium heat, add the onion and bell pepper and cook until just softened, about 5 minutes. Season with salt and pepper, stir in the tomato and garlic and cook for 3 minutes. Stir in the rice and the simmering broth; scatter the chorizo on top. Bring to a boil and season with salt and pepper. Reduce the heat to low and loosely cover the pan with foil. Simmer for 10 minutes.', 'Scatter the shrimp, mussels and squid on the rice, cover and cook until the rice is tender and the seafood is cooked through, 15 to 20 minutes. Stir in the peas during the last 5 minutes of cooking. Remove the paella from the heat and let rest for 5 minutes. Garnish with the lemon wedges and parsley.']",http://images.media-allrecipes.com/userphotos/250x250/977916.jpg,25,0.0,0,1498114502,Seafood  Paella,40,http://allrecipes.com/Recipe/133371/,Mixed
26,Every Day with Rachael Ray,5,"Try paella at home for a spiced up weeknight dinner -- it's easier than it looks, but just as delish!",False,[],"['1 tablespoon vegetable oil', '8 ounces chorizo, sliced 1/4 inch thick', '1 1/2 cups long-grain white rice', '1 1/2 cups red salsa', '2 cups thawed frozen corn', '1 (15 ounce) can sliced large black olives', '1/2 cup chopped fresh cilantro']","['In a heavy medium saucepan, heat the oil over medium heat. Add the chorizo and cook, stirring occasionally, until lightly browned, about 4 minutes. Add the rice and stir for 1 minute to coat. Stir in 1 1/2 cups water and the salsa and bring to a boil, stirring once or twice. Cover the pot and simmer on low heat for 20 minutes.', 'Fluff the rice and stir in the corn. Remove from the heat, cover and let stand for 5 minutes. Stir in the olives and cilantro.']",http://images.media-allrecipes.com/userphotos/250x250/977062.jpg,25,0.0,0,1498114504,Red Rice with Chorizo,30,http://allrecipes.com/Recipe/134371/,Other
27,Rodale,0,.,False,[],"['1 pound medium-size shrimp', '1 (5 ounce) package yellow saffron rice', '1 (14 ounce) can diced tomatoes with zesty jalapenos', '1/2 (14 ounce) can artichoke hearts', '2 tablespoons olive oil', '2 cloves garlic, minced', '1/3 pound low-fat smoked turkey sausage', '1 cup chopped onion', '1/2 (8 ounce) can peas']","['In a 2-quart microwave-safe dish, stir together the shrimp, oil, and garlic until the shrimp are coated with oil. Nuke for 3 to 5 minutes, stirring once, until the shrimp are just pink. Remove the shrimp and all but 1 tablespoon of any accumulated juices to a plate, and cover with foil to keep warm.', 'Now toss the sausage and onion into the microwavable dish and heat for 5 to 7 minutes, stirring once. Mix in the rice and tomatoes, and microwave for 1 to 3 minutes. Stir in 1-1/2 c water and cover the dish tightly with plastic wrap. Microwave for 15 to 18 minutes, or until the rice is tender. Uncover, and stir in the artichokes and peas. Cover the shrimp with the rice and pour the shrimp juices over the top. Nuke for 1 to 3 minutes.']",http://images.media-allrecipes.com/global/recipes/nophoto/nopicture-910x511.png,0,0.0,0,1498115136,Painless Paella,0,http://allrecipes.com/Recipe/134859/,Seafood
28,Rodale,0,"Tasty, exotic, low-fat and surprisingly easy to make.",False,[],"['1 onion, sliced', '2 stalks asparagus, sliced', '1 green bell pepper, diced', '1 red bell pepper, diced', '3 tomatoes, diced', '1 pinch saffron', '2 tablespoons tomato paste', '1 pound rice', '1 pound steak, sliced', '1 tablespoon vegetable oil', '1 clove garlic, minced', '1 cup chicken stock', '1/2 cup dry red wine']","[""Slice the onion and the asparagus, and diced the peppers and tomatoes. Boil a gallon of water in a large pot and add the saffron and half the tomato paste. Then add the rice and boil for 10 minutes. Remove from heat, and spoon the rice into a large baking dish. (Don't discard the water.) Put the vegetables in the pot and heat on medium for 5 minutes; the water doesn't have to boil. Strain the vegetables and mix into the rice."", 'Preheat your oven to 350 degrees F. In a saucepan, mix the steak, oil, garlic, stock, and remaining tomato paste. Heat on high, stirring occasionally, until the meat is brown (about 5 minutes). Add the wine and simmer, covered, for 3 minutes.', 'Mix the steak and juices into the baking dish. Cover the dish with foil and bake it at 350 degrees F for about 15 minutes, stirring every 3 minutes.']",http://images.media-allrecipes.com/global/recipes/nophoto/nopicture-910x511.png,0,0.0,0,1498115228,Paella,0,http://allrecipes.com/Recipe/134902/,Traditional
29,Martha Stewart,25,"You don't need a paella pan to make this meal. Use a wide, shallow saute pan with a lid. If you are taking this dish to a party, reheat it covered; add water as needed.",False,"['Note', ""Paella is usually flavored and colored with saffron, the world's most expensive spice. We used paprika and turmeric instead, which are less expensive but create an equally good dish.""]","['2 tablespoons olive oil', '3/4 pound medium shrimp, peeled and deveined', '1 (12 ounce) package chicken sausage, sliced in 1/2-inch rounds', '1 medium onion, finely chopped', '2 cloves garlic, minced', '1 1/2 cups long-grain rice', '1/4 teaspoon paprika', '1/4 teaspoon ground turmeric', '1 (14.5 ounce) can diced tomatoes', '2 (14.5 ounce) cans reduced-sodium chicken broth', 'Coarse salt and ground pepper', '1 cup frozen green peas, thawed']","['In a heavy 12-inch saute pan, heat 1 tablespoon oil over medium-high heat. Cook shrimp until just pink on both sides, 4 to 5 minutes (do not overcook). Transfer to a plate.', 'Add remaining tablespoon oil and sausage to pan; cook over medium-high heat until beginning to brown, about 2 minutes. Add onion, and cook, stirring frequently, until translucent, 3 to 4 minutes. Add garlic and rice; cook, stirring to coat, until rice is translucent, 1 to 2 minutes.', 'Stir in paprika, turmeric, tomatoes, and broth, scraping up browned bits from bottom of pan with a wooden spoon. Season with salt and pepper.', 'Bring to a boil, then reduce heat to a simmer. Cover, and cook until rice is tender and has absorbed almost all liquid, 20 to 25 minutes. Stir in peas; cook 1 minute. Stir in cooked shrimp; serve immediately.']",http://images.media-allrecipes.com/global/recipes/nophoto/nopicture-910x511.png,0,4.0,1,1498115670,Easy Paella,50,http://allrecipes.com/Recipe/136375/,Mixed
